{"schema_version":"0.3.0","phase":"R1.5","production_review_id":"tolkappiyam-r15-production-1392","work_id":"tolkappiyam","record_id":"tolkappiyam-1392","source_sequence":1392,"review_sequence_number":1392,"source_snapshot":{"canonical_record_path":"corpus/tolkappiyam/nurpas/1392.md","canonical_record_git_blob_sha":"b2aef19f4f3107b8249b11bad8c01bb05a04f694","canonical_record_sha256":"c87ed0aa1938ae4b8813b3c286bb880b921e7df4720a4fd828366793636476db","canonical_body_sha256":"271cd9ff048a9edeb623214059132f480b03f57aec05b4146701903be68a0e83","textual_status":"complete","canonical_text_available":true,"parsing_confidence":"high"},"source_structure_reviewed":{"canonical_record_id":"tolkappiyam-1392","stable_semantic_id":"porul-seyyuliyal-137","traditional_number":137,"display_number":"137","adhikaram":{"id":"porul","number":3,"title_as_printed":"பொருளதிகாரம்"},"iyal":{"id":"porul-seyyuliyal","number":8,"source_sequence":26,"title_as_printed":"செய்யுளியல்"}},"dimensions_considered":29,"dimension_reviews":[{"ordinal":1,"dimension":"literary_domain","status":"no_qualifying_evidence_identified","concept_evidence_ids":[],"incidental_examples":[],"review_note":"No qualifying evidence identified."},{"ordinal":2,"dimension":"tinai_turai","status":"no_qualifying_evidence_identified","concept_evidence_ids":[],"incidental_examples":[],"review_note":"No qualifying evidence identified."},{"ordinal":3,"dimension":"landscape_environment","status":"no_qualifying_evidence_identified","concept_evidence_ids":[],"incidental_examples":[],"review_note":"No qualifying evidence identified."},{"ordinal":4,"dimension":"season_weather_time","status":"no_qualifying_evidence_identified","concept_evidence_ids":[],"incidental_examples":[],"review_note":"No qualifying evidence identified."},{"ordinal":5,"dimension":"flora","status":"no_qualifying_evidence_identified","concept_evidence_ids":[],"incidental_examples":[],"review_note":"No qualifying evidence identified."},{"ordinal":6,"dimension":"fauna","status":"no_qualifying_evidence_identified","concept_evidence_ids":[],"incidental_examples":[],"review_note":"No qualifying evidence identified."},{"ordinal":7,"dimension":"people_social_roles","status":"no_qualifying_evidence_identified","concept_evidence_ids":[],"incidental_examples":[],"review_note":"No qualifying evidence identified."},{"ordinal":8,"dimension":"relationships","status":"no_qualifying_evidence_identified","concept_evidence_ids":[],"incidental_examples":[],"review_note":"No qualifying evidence identified."},{"ordinal":9,"dimension":"emotion_lived_experience","status":"no_qualifying_evidence_identified","concept_evidence_ids":[],"incidental_examples":[],"review_note":"No qualifying evidence identified."},{"ordinal":10,"dimension":"occupations_production","status":"no_qualifying_evidence_identified","concept_evidence_ids":[],"incidental_examples":[],"review_note":"No qualifying evidence identified."},{"ordinal":11,"dimension":"food_subsistence","status":"no_qualifying_evidence_identified","concept_evidence_ids":[],"incidental_examples":[],"review_note":"No qualifying evidence identified."},{"ordinal":12,"dimension":"clothing_ornaments_adornment","status":"no_qualifying_evidence_identified","concept_evidence_ids":[],"incidental_examples":[],"review_note":"No qualifying evidence identified."},{"ordinal":13,"dimension":"material_culture_everyday_objects","status":"no_qualifying_evidence_identified","concept_evidence_ids":[],"incidental_examples":[],"review_note":"No qualifying evidence identified."},{"ordinal":14,"dimension":"weapons_warfare","status":"no_qualifying_evidence_identified","concept_evidence_ids":[],"incidental_examples":[],"review_note":"No qualifying evidence identified."},{"ordinal":15,"dimension":"mobility_transport","status":"no_qualifying_evidence_identified","concept_evidence_ids":[],"incidental_examples":[],"review_note":"No qualifying evidence identified."},{"ordinal":16,"dimension":"settlements_built_environment","status":"no_qualifying_evidence_identified","concept_evidence_ids":[],"incidental_examples":[],"review_note":"No qualifying evidence identified."},{"ordinal":17,"dimension":"economy","status":"no_qualifying_evidence_identified","concept_evidence_ids":[],"incidental_examples":[],"review_note":"No qualifying evidence identified."},{"ordinal":18,"dimension":"trade_exchange","status":"no_qualifying_evidence_identified","concept_evidence_ids":[],"incidental_examples":[],"review_note":"No qualifying evidence identified."},{"ordinal":19,"dimension":"polity_political_life","status":"no_qualifying_evidence_identified","concept_evidence_ids":[],"incidental_examples":[],"review_note":"No qualifying evidence identified."},{"ordinal":20,"dimension":"communities_social_groups","status":"no_qualifying_evidence_identified","concept_evidence_ids":[],"incidental_examples":[],"review_note":"No qualifying evidence identified."},{"ordinal":21,"dimension":"family_gender_kinship","status":"no_qualifying_evidence_identified","concept_evidence_ids":[],"incidental_examples":[],"review_note":"No qualifying evidence identified."},{"ordinal":22,"dimension":"religion_ritual","status":"no_qualifying_evidence_identified","concept_evidence_ids":[],"incidental_examples":[],"review_note":"No qualifying evidence identified."},{"ordinal":23,"dimension":"death_mourning_memory","status":"no_qualifying_evidence_identified","concept_evidence_ids":[],"incidental_examples":[],"review_note":"No qualifying evidence identified."},{"ordinal":24,"dimension":"arts_music_performance","status":"no_qualifying_evidence_identified","concept_evidence_ids":[],"incidental_examples":[],"review_note":"No qualifying evidence identified."},{"ordinal":25,"dimension":"knowledge_technology","status":"grammatical_concept_evidence_recorded","concept_evidence_ids":["gram.r15.5bd31f82374ddb91853b0432"],"incidental_examples":[],"review_note":"Qualifying grammatical/poetics concept evidence recorded."},{"ordinal":26,"dimension":"values_ethical_concepts","status":"no_qualifying_evidence_identified","concept_evidence_ids":[],"incidental_examples":[],"review_note":"No qualifying evidence identified."},{"ordinal":27,"dimension":"body_health","status":"no_qualifying_evidence_identified","concept_evidence_ids":[],"incidental_examples":[],"review_note":"No qualifying evidence identified."},{"ordinal":28,"dimension":"named_entities","status":"no_qualifying_evidence_identified","concept_evidence_ids":[],"incidental_examples":[],"review_note":"No qualifying evidence identified."},{"ordinal":29,"dimension":"textual_intertextual_relationships","status":"grammatical_concept_evidence_recorded","concept_evidence_ids":["gram.r15.9427b0cf361aaf5a568ff9d5"],"incidental_examples":[],"review_note":"Qualifying grammatical/poetics concept evidence recorded."}],"concept_evidence":[{"schema_version":"0.3.0","concept_evidence_id":"gram.r15.9427b0cf361aaf5a568ff9d5","work_id":"tolkappiyam","record_id":"tolkappiyam-1392","concept_id":"textual.poetic_form.formal_context","dimension":"textual_intertextual_relationships","surface_form":"ஒத்து மூன்று ஆகும் ஒத்தாழிசையே\nதரவின் சுருங்கித் தோன்றும் என்ப.","source_location":"markdown:canonical-body:1:0-2:32","evidence_class":"GRAMMATICAL_CONCEPT_EVIDENCE","classification_basis":"tolkappiyam_mapping","canonical_record_sha256":"c87ed0aa1938ae4b8813b3c286bb880b921e7df4720a4fd828366793636476db","confidence":"high","review_status":"reviewed","notes":"The நூற்பா formally defines செய்யுள், யாப்பு, metre, composition, genre, speaker, or textual-form structure."},{"schema_version":"0.3.0","concept_evidence_id":"gram.r15.5bd31f82374ddb91853b0432","work_id":"tolkappiyam","record_id":"tolkappiyam-1392","concept_id":"knowledge.poetics.prosody","dimension":"knowledge_technology","surface_form":"ஒத்து மூன்று ஆகும் ஒத்தாழிசையே\nதரவின் சுருங்கித் தோன்றும் என்ப.","source_location":"markdown:canonical-body:1:0-2:32","evidence_class":"GRAMMATICAL_CONCEPT_EVIDENCE","classification_basis":"tolkappiyam_mapping","canonical_record_sha256":"c87ed0aa1938ae4b8813b3c286bb880b921e7df4720a4fd828366793636476db","confidence":"high","review_status":"reviewed","notes":"The நூற்பா formally defines prosodic, metrical, compositional, or textual-method knowledge."}],"review_status":"reviewed","reviewer_type":"assistant_assisted","empty_cell_semantics":"No qualifying evidence identified in this reviewed நூற்பா; never evidence of historical absence.","audit_control":{"review_manifest_path":"research/audits/r15-premerge/tolkappiyam/review-manifest.json","dimension_crosswalk_path":"research/audits/r15-premerge/tolkappiyam/dimension-crosswalk.json","checked_after_fresh_source_review":true,"control_role":"coverage_and_representative_formal_support_only","crosswalk_used_to_create_classification":false},"next_record_allowed":"tolkappiyam-1393"}
