{"schema_version":"0.3.0","phase":"R1.5","production_review_id":"tolkappiyam-r15-production-0702","work_id":"tolkappiyam","record_id":"tolkappiyam-0702","source_sequence":702,"review_sequence_number":702,"source_snapshot":{"canonical_record_path":"corpus/tolkappiyam/nurpas/0702.md","canonical_record_git_blob_sha":"10476643e062564b38a5f128501557c0e29c2352","canonical_record_sha256":"f60e9ca51c9edfe4a55a3777ed588ffbc93a2cae1547c9d21bb1b89ccda9ebec","canonical_body_sha256":"bb5c2781526946c0319f6721389987239f33c52ba99fc68b5d3866110650bd9d","textual_status":"complete","canonical_text_available":true,"parsing_confidence":"high"},"source_structure_reviewed":{"canonical_record_id":"tolkappiyam-0702","stable_semantic_id":"sol-vinaiyiyal-020","traditional_number":20,"display_number":"20","adhikaram":{"id":"sol","number":2,"title_as_printed":"சொல்லதிகாரம்"},"iyal":{"id":"sol-vinaiyiyal","number":6,"source_sequence":15,"title_as_printed":"வினையியல்"}},"dimensions_considered":29,"dimension_reviews":[{"ordinal":1,"dimension":"literary_domain","status":"no_qualifying_evidence_identified","concept_evidence_ids":[],"incidental_examples":[],"review_note":"No qualifying evidence identified."},{"ordinal":2,"dimension":"tinai_turai","status":"no_qualifying_evidence_identified","concept_evidence_ids":[],"incidental_examples":[],"review_note":"No qualifying evidence identified."},{"ordinal":3,"dimension":"landscape_environment","status":"no_qualifying_evidence_identified","concept_evidence_ids":[],"incidental_examples":[],"review_note":"No qualifying evidence identified."},{"ordinal":4,"dimension":"season_weather_time","status":"no_qualifying_evidence_identified","concept_evidence_ids":[],"incidental_examples":[],"review_note":"No qualifying evidence identified."},{"ordinal":5,"dimension":"flora","status":"no_qualifying_evidence_identified","concept_evidence_ids":[],"incidental_examples":[],"review_note":"No qualifying evidence identified."},{"ordinal":6,"dimension":"fauna","status":"no_qualifying_evidence_identified","concept_evidence_ids":[],"incidental_examples":[],"review_note":"No qualifying evidence identified."},{"ordinal":7,"dimension":"people_social_roles","status":"no_qualifying_evidence_identified","concept_evidence_ids":[],"incidental_examples":[],"review_note":"No qualifying evidence identified."},{"ordinal":8,"dimension":"relationships","status":"no_qualifying_evidence_identified","concept_evidence_ids":[],"incidental_examples":[],"review_note":"No qualifying evidence identified."},{"ordinal":9,"dimension":"emotion_lived_experience","status":"no_qualifying_evidence_identified","concept_evidence_ids":[],"incidental_examples":[],"review_note":"No qualifying evidence identified."},{"ordinal":10,"dimension":"occupations_production","status":"no_qualifying_evidence_identified","concept_evidence_ids":[],"incidental_examples":[],"review_note":"No qualifying evidence identified."},{"ordinal":11,"dimension":"food_subsistence","status":"no_qualifying_evidence_identified","concept_evidence_ids":[],"incidental_examples":[],"review_note":"No qualifying evidence identified."},{"ordinal":12,"dimension":"clothing_ornaments_adornment","status":"no_qualifying_evidence_identified","concept_evidence_ids":[],"incidental_examples":[],"review_note":"No qualifying evidence identified."},{"ordinal":13,"dimension":"material_culture_everyday_objects","status":"no_qualifying_evidence_identified","concept_evidence_ids":[],"incidental_examples":[],"review_note":"No qualifying evidence identified."},{"ordinal":14,"dimension":"weapons_warfare","status":"no_qualifying_evidence_identified","concept_evidence_ids":[],"incidental_examples":[],"review_note":"No qualifying evidence identified."},{"ordinal":15,"dimension":"mobility_transport","status":"no_qualifying_evidence_identified","concept_evidence_ids":[],"incidental_examples":[],"review_note":"No qualifying evidence identified."},{"ordinal":16,"dimension":"settlements_built_environment","status":"no_qualifying_evidence_identified","concept_evidence_ids":[],"incidental_examples":[],"review_note":"No qualifying evidence identified."},{"ordinal":17,"dimension":"economy","status":"no_qualifying_evidence_identified","concept_evidence_ids":[],"incidental_examples":[],"review_note":"No qualifying evidence identified."},{"ordinal":18,"dimension":"trade_exchange","status":"no_qualifying_evidence_identified","concept_evidence_ids":[],"incidental_examples":[],"review_note":"No qualifying evidence identified."},{"ordinal":19,"dimension":"polity_political_life","status":"no_qualifying_evidence_identified","concept_evidence_ids":[],"incidental_examples":[],"review_note":"No qualifying evidence identified."},{"ordinal":20,"dimension":"communities_social_groups","status":"no_qualifying_evidence_identified","concept_evidence_ids":[],"incidental_examples":[],"review_note":"No qualifying evidence identified."},{"ordinal":21,"dimension":"family_gender_kinship","status":"no_qualifying_evidence_identified","concept_evidence_ids":[],"incidental_examples":[],"review_note":"No qualifying evidence identified."},{"ordinal":22,"dimension":"religion_ritual","status":"no_qualifying_evidence_identified","concept_evidence_ids":[],"incidental_examples":[],"review_note":"No qualifying evidence identified."},{"ordinal":23,"dimension":"death_mourning_memory","status":"no_qualifying_evidence_identified","concept_evidence_ids":[],"incidental_examples":[],"review_note":"No qualifying evidence identified."},{"ordinal":24,"dimension":"arts_music_performance","status":"no_qualifying_evidence_identified","concept_evidence_ids":[],"incidental_examples":[],"review_note":"No qualifying evidence identified."},{"ordinal":25,"dimension":"knowledge_technology","status":"grammatical_concept_evidence_recorded","concept_evidence_ids":["gram.r15.e9115c3c4109bcf6b279d041","gram.r15.38669349d37bfbc03fbba8d8"],"incidental_examples":[],"review_note":"Qualifying grammatical/poetics concept evidence recorded."},{"ordinal":26,"dimension":"values_ethical_concepts","status":"no_qualifying_evidence_identified","concept_evidence_ids":[],"incidental_examples":[],"review_note":"No qualifying evidence identified."},{"ordinal":27,"dimension":"body_health","status":"no_qualifying_evidence_identified","concept_evidence_ids":[],"incidental_examples":[],"review_note":"No qualifying evidence identified."},{"ordinal":28,"dimension":"named_entities","status":"no_qualifying_evidence_identified","concept_evidence_ids":[],"incidental_examples":[],"review_note":"No qualifying evidence identified."},{"ordinal":29,"dimension":"textual_intertextual_relationships","status":"no_qualifying_evidence_identified","concept_evidence_ids":[],"incidental_examples":[],"review_note":"No qualifying evidence identified."}],"concept_evidence":[{"schema_version":"0.3.0","concept_evidence_id":"gram.r15.e9115c3c4109bcf6b279d041","work_id":"tolkappiyam","record_id":"tolkappiyam-0702","concept_id":"knowledge.grammar.morphology","dimension":"knowledge_technology","surface_form":"ஒன்றன் படர்க்கை த ற ட ஊர்ந்த\nகுன்றியலுகரத்து இறுதி ஆகும்.","source_location":"markdown:canonical-body:1:0-2:28","evidence_class":"GRAMMATICAL_CONCEPT_EVIDENCE","classification_basis":"tolkappiyam_mapping","canonical_record_sha256":"f60e9ca51c9edfe4a55a3777ed588ffbc93a2cae1547c9d21bb1b89ccda9ebec","confidence":"high","review_status":"reviewed","notes":"The நூற்பா formally classifies or constrains nominal, verbal, case, particle, address, or related morphological forms in சொல்லதிகாரம்."},{"schema_version":"0.3.0","concept_evidence_id":"gram.r15.38669349d37bfbc03fbba8d8","work_id":"tolkappiyam","record_id":"tolkappiyam-0702","concept_id":"knowledge.grammar.syntax","dimension":"knowledge_technology","surface_form":"ஒன்றன் படர்க்கை த ற ட ஊர்ந்த\nகுன்றியலுகரத்து இறுதி ஆகும்.","source_location":"markdown:canonical-body:1:0-2:28","evidence_class":"GRAMMATICAL_CONCEPT_EVIDENCE","classification_basis":"tolkappiyam_mapping","canonical_record_sha256":"f60e9ca51c9edfe4a55a3777ed588ffbc93a2cae1547c9d21bb1b89ccda9ebec","confidence":"high","review_status":"reviewed","notes":"The நூற்பா formally states a syntactic, agreement, case-relation, ordering, completion, or dependency rule."}],"review_status":"reviewed","reviewer_type":"assistant_assisted","empty_cell_semantics":"No qualifying evidence identified in this reviewed நூற்பா; never evidence of historical absence.","audit_control":{"review_manifest_path":"research/audits/r15-premerge/tolkappiyam/review-manifest.json","dimension_crosswalk_path":"research/audits/r15-premerge/tolkappiyam/dimension-crosswalk.json","checked_after_fresh_source_review":true,"control_role":"coverage_and_representative_formal_support_only","crosswalk_used_to_create_classification":false},"next_record_allowed":"tolkappiyam-0703"}
