{"schema_version":"0.3.0","phase":"R1.5","production_review_id":"tolkappiyam-r15-production-0369","work_id":"tolkappiyam","record_id":"tolkappiyam-0369","source_sequence":369,"review_sequence_number":369,"source_snapshot":{"canonical_record_path":"corpus/tolkappiyam/nurpas/0369.md","canonical_record_git_blob_sha":"59c7005574c2fb4ac7184594904dcba747576598","canonical_record_sha256":"c32461fdcdc250a49883391063e953175e26cfc8c20615725bb339adc3aeec90","canonical_body_sha256":"27db82c92ef7967124ff218e2822f987e9e477b3b84e1d8f7b437dfefe9904b0","textual_status":"complete","canonical_text_available":true,"parsing_confidence":"high"},"source_structure_reviewed":{"canonical_record_id":"tolkappiyam-0369","stable_semantic_id":"ezhuthu-pullimayangiyal-073","traditional_number":73,"display_number":"73","adhikaram":{"id":"ezhuthu","number":1,"title_as_printed":"எழுத்ததிகாரம்"},"iyal":{"id":"ezhuthu-pullimayangiyal","number":8,"source_sequence":8,"title_as_printed":"புள்ளிமயங்கியல்"}},"dimensions_considered":29,"dimension_reviews":[{"ordinal":1,"dimension":"literary_domain","status":"no_qualifying_evidence_identified","concept_evidence_ids":[],"incidental_examples":[],"review_note":"No qualifying evidence identified."},{"ordinal":2,"dimension":"tinai_turai","status":"no_qualifying_evidence_identified","concept_evidence_ids":[],"incidental_examples":[],"review_note":"No qualifying evidence identified."},{"ordinal":3,"dimension":"landscape_environment","status":"no_qualifying_evidence_identified","concept_evidence_ids":[],"incidental_examples":[],"review_note":"No qualifying evidence identified."},{"ordinal":4,"dimension":"season_weather_time","status":"no_qualifying_evidence_identified","concept_evidence_ids":[],"incidental_examples":[],"review_note":"No qualifying evidence identified."},{"ordinal":5,"dimension":"flora","status":"no_qualifying_evidence_identified","concept_evidence_ids":[],"incidental_examples":[],"review_note":"No qualifying evidence identified."},{"ordinal":6,"dimension":"fauna","status":"no_qualifying_evidence_identified","concept_evidence_ids":[],"incidental_examples":[],"review_note":"No qualifying evidence identified."},{"ordinal":7,"dimension":"people_social_roles","status":"no_qualifying_evidence_identified","concept_evidence_ids":[],"incidental_examples":[],"review_note":"No qualifying evidence identified."},{"ordinal":8,"dimension":"relationships","status":"no_qualifying_evidence_identified","concept_evidence_ids":[],"incidental_examples":[],"review_note":"No qualifying evidence identified."},{"ordinal":9,"dimension":"emotion_lived_experience","status":"no_qualifying_evidence_identified","concept_evidence_ids":[],"incidental_examples":[],"review_note":"No qualifying evidence identified."},{"ordinal":10,"dimension":"occupations_production","status":"no_qualifying_evidence_identified","concept_evidence_ids":[],"incidental_examples":[],"review_note":"No qualifying evidence identified."},{"ordinal":11,"dimension":"food_subsistence","status":"no_qualifying_evidence_identified","concept_evidence_ids":[],"incidental_examples":[],"review_note":"No qualifying evidence identified."},{"ordinal":12,"dimension":"clothing_ornaments_adornment","status":"no_qualifying_evidence_identified","concept_evidence_ids":[],"incidental_examples":[],"review_note":"No qualifying evidence identified."},{"ordinal":13,"dimension":"material_culture_everyday_objects","status":"no_qualifying_evidence_identified","concept_evidence_ids":[],"incidental_examples":[],"review_note":"No qualifying evidence identified."},{"ordinal":14,"dimension":"weapons_warfare","status":"no_qualifying_evidence_identified","concept_evidence_ids":[],"incidental_examples":[],"review_note":"No qualifying evidence identified."},{"ordinal":15,"dimension":"mobility_transport","status":"no_qualifying_evidence_identified","concept_evidence_ids":[],"incidental_examples":[],"review_note":"No qualifying evidence identified."},{"ordinal":16,"dimension":"settlements_built_environment","status":"no_qualifying_evidence_identified","concept_evidence_ids":[],"incidental_examples":[],"review_note":"No qualifying evidence identified."},{"ordinal":17,"dimension":"economy","status":"no_qualifying_evidence_identified","concept_evidence_ids":[],"incidental_examples":[],"review_note":"No qualifying evidence identified."},{"ordinal":18,"dimension":"trade_exchange","status":"no_qualifying_evidence_identified","concept_evidence_ids":[],"incidental_examples":[],"review_note":"No qualifying evidence identified."},{"ordinal":19,"dimension":"polity_political_life","status":"no_qualifying_evidence_identified","concept_evidence_ids":[],"incidental_examples":[],"review_note":"No qualifying evidence identified."},{"ordinal":20,"dimension":"communities_social_groups","status":"no_qualifying_evidence_identified","concept_evidence_ids":[],"incidental_examples":[],"review_note":"No qualifying evidence identified."},{"ordinal":21,"dimension":"family_gender_kinship","status":"no_qualifying_evidence_identified","concept_evidence_ids":[],"incidental_examples":[],"review_note":"No qualifying evidence identified."},{"ordinal":22,"dimension":"religion_ritual","status":"no_qualifying_evidence_identified","concept_evidence_ids":[],"incidental_examples":[],"review_note":"No qualifying evidence identified."},{"ordinal":23,"dimension":"death_mourning_memory","status":"no_qualifying_evidence_identified","concept_evidence_ids":[],"incidental_examples":[],"review_note":"No qualifying evidence identified."},{"ordinal":24,"dimension":"arts_music_performance","status":"no_qualifying_evidence_identified","concept_evidence_ids":[],"incidental_examples":[],"review_note":"No qualifying evidence identified."},{"ordinal":25,"dimension":"knowledge_technology","status":"grammatical_concept_evidence_recorded","concept_evidence_ids":["gram.r15.2c46e7d3e60f348794a0b61e"],"incidental_examples":[],"review_note":"Qualifying grammatical/poetics concept evidence recorded."},{"ordinal":26,"dimension":"values_ethical_concepts","status":"no_qualifying_evidence_identified","concept_evidence_ids":[],"incidental_examples":[],"review_note":"No qualifying evidence identified."},{"ordinal":27,"dimension":"body_health","status":"no_qualifying_evidence_identified","concept_evidence_ids":[],"incidental_examples":[],"review_note":"No qualifying evidence identified."},{"ordinal":28,"dimension":"named_entities","status":"no_qualifying_evidence_identified","concept_evidence_ids":[],"incidental_examples":[],"review_note":"No qualifying evidence identified."},{"ordinal":29,"dimension":"textual_intertextual_relationships","status":"no_qualifying_evidence_identified","concept_evidence_ids":[],"incidental_examples":[],"review_note":"No qualifying evidence identified."}],"concept_evidence":[{"schema_version":"0.3.0","concept_evidence_id":"gram.r15.2c46e7d3e60f348794a0b61e","work_id":"tolkappiyam","record_id":"tolkappiyam-0369","concept_id":"knowledge.grammar.morphophonology","dimension":"knowledge_technology","surface_form":"அல்வழி எல்லாம் உறழ் என மொழிப.","source_location":"markdown:canonical-body:1:0-1:29","evidence_class":"GRAMMATICAL_CONCEPT_EVIDENCE","classification_basis":"tolkappiyam_mapping","canonical_record_sha256":"c32461fdcdc250a49883391063e953175e26cfc8c20615725bb339adc3aeec90","confidence":"high","review_status":"reviewed","notes":"The rule formally permits variation throughout the அல்வழி environment."}],"review_status":"reviewed","reviewer_type":"assistant_assisted","empty_cell_semantics":"No qualifying evidence identified in this reviewed நூற்பா; never evidence of historical absence.","audit_control":{"review_manifest_path":"research/audits/r15-premerge/tolkappiyam/review-manifest.json","dimension_crosswalk_path":"research/audits/r15-premerge/tolkappiyam/dimension-crosswalk.json","checked_after_fresh_source_review":true,"control_role":"coverage_and_representative_formal_support_only","crosswalk_used_to_create_classification":false},"next_record_allowed":"tolkappiyam-0370"}
