{"schema_version":"0.3.0","phase":"R1.5","production_review_id":"tolkappiyam-r15-production-0149","work_id":"tolkappiyam","record_id":"tolkappiyam-0149","source_sequence":149,"review_sequence_number":149,"source_snapshot":{"canonical_record_path":"corpus/tolkappiyam/nurpas/0149.md","canonical_record_git_blob_sha":"4d0cf65b7f2bfb54999791a48294c67a9d4cfcc4","canonical_record_sha256":"5942772656fd5560ebcc3c6d8a78fe003b32ef7164596160ed50e0c071065f26","canonical_body_sha256":"d859b3bfcb54d8e3418e9b3f77b5dacd9a67c0335eaf217706093514dc6a5dbd","textual_status":"complete","canonical_text_available":true,"parsing_confidence":"high"},"source_structure_reviewed":{"canonical_record_id":"tolkappiyam-0149","stable_semantic_id":"ezhuthu-thogaimarabu-006","traditional_number":6,"display_number":"6","adhikaram":{"id":"ezhuthu","number":1,"title_as_printed":"எழுத்ததிகாரம்"},"iyal":{"id":"ezhuthu-thogaimarabu","number":5,"source_sequence":5,"title_as_printed":"தொகைமரபு"}},"dimensions_considered":29,"dimension_reviews":[{"ordinal":1,"dimension":"literary_domain","status":"no_qualifying_evidence_identified","concept_evidence_ids":[],"incidental_examples":[],"review_note":"No qualifying evidence identified."},{"ordinal":2,"dimension":"tinai_turai","status":"no_qualifying_evidence_identified","concept_evidence_ids":[],"incidental_examples":[],"review_note":"No qualifying evidence identified."},{"ordinal":3,"dimension":"landscape_environment","status":"no_qualifying_evidence_identified","concept_evidence_ids":[],"incidental_examples":[],"review_note":"No qualifying evidence identified."},{"ordinal":4,"dimension":"season_weather_time","status":"no_qualifying_evidence_identified","concept_evidence_ids":[],"incidental_examples":[],"review_note":"No qualifying evidence identified."},{"ordinal":5,"dimension":"flora","status":"no_qualifying_evidence_identified","concept_evidence_ids":[],"incidental_examples":[],"review_note":"No qualifying evidence identified."},{"ordinal":6,"dimension":"fauna","status":"no_qualifying_evidence_identified","concept_evidence_ids":[],"incidental_examples":[],"review_note":"No qualifying evidence identified."},{"ordinal":7,"dimension":"people_social_roles","status":"no_qualifying_evidence_identified","concept_evidence_ids":[],"incidental_examples":[],"review_note":"No qualifying evidence identified."},{"ordinal":8,"dimension":"relationships","status":"no_qualifying_evidence_identified","concept_evidence_ids":[],"incidental_examples":[],"review_note":"No qualifying evidence identified."},{"ordinal":9,"dimension":"emotion_lived_experience","status":"no_qualifying_evidence_identified","concept_evidence_ids":[],"incidental_examples":[],"review_note":"No qualifying evidence identified."},{"ordinal":10,"dimension":"occupations_production","status":"no_qualifying_evidence_identified","concept_evidence_ids":[],"incidental_examples":[],"review_note":"No qualifying evidence identified."},{"ordinal":11,"dimension":"food_subsistence","status":"no_qualifying_evidence_identified","concept_evidence_ids":[],"incidental_examples":[],"review_note":"No qualifying evidence identified."},{"ordinal":12,"dimension":"clothing_ornaments_adornment","status":"no_qualifying_evidence_identified","concept_evidence_ids":[],"incidental_examples":[],"review_note":"No qualifying evidence identified."},{"ordinal":13,"dimension":"material_culture_everyday_objects","status":"no_qualifying_evidence_identified","concept_evidence_ids":[],"incidental_examples":[],"review_note":"No qualifying evidence identified."},{"ordinal":14,"dimension":"weapons_warfare","status":"no_qualifying_evidence_identified","concept_evidence_ids":[],"incidental_examples":[],"review_note":"No qualifying evidence identified."},{"ordinal":15,"dimension":"mobility_transport","status":"no_qualifying_evidence_identified","concept_evidence_ids":[],"incidental_examples":[],"review_note":"No qualifying evidence identified."},{"ordinal":16,"dimension":"settlements_built_environment","status":"no_qualifying_evidence_identified","concept_evidence_ids":[],"incidental_examples":[],"review_note":"No qualifying evidence identified."},{"ordinal":17,"dimension":"economy","status":"no_qualifying_evidence_identified","concept_evidence_ids":[],"incidental_examples":[],"review_note":"No qualifying evidence identified."},{"ordinal":18,"dimension":"trade_exchange","status":"no_qualifying_evidence_identified","concept_evidence_ids":[],"incidental_examples":[],"review_note":"No qualifying evidence identified."},{"ordinal":19,"dimension":"polity_political_life","status":"no_qualifying_evidence_identified","concept_evidence_ids":[],"incidental_examples":[],"review_note":"No qualifying evidence identified."},{"ordinal":20,"dimension":"communities_social_groups","status":"no_qualifying_evidence_identified","concept_evidence_ids":[],"incidental_examples":[],"review_note":"No qualifying evidence identified."},{"ordinal":21,"dimension":"family_gender_kinship","status":"no_qualifying_evidence_identified","concept_evidence_ids":[],"incidental_examples":[],"review_note":"No qualifying evidence identified."},{"ordinal":22,"dimension":"religion_ritual","status":"no_qualifying_evidence_identified","concept_evidence_ids":[],"incidental_examples":[],"review_note":"No qualifying evidence identified."},{"ordinal":23,"dimension":"death_mourning_memory","status":"no_qualifying_evidence_identified","concept_evidence_ids":[],"incidental_examples":[],"review_note":"No qualifying evidence identified."},{"ordinal":24,"dimension":"arts_music_performance","status":"no_qualifying_evidence_identified","concept_evidence_ids":[],"incidental_examples":[],"review_note":"No qualifying evidence identified."},{"ordinal":25,"dimension":"knowledge_technology","status":"grammatical_concept_evidence_recorded","concept_evidence_ids":["gram.r15.664dcbf03c735ccb76c3a9b9"],"incidental_examples":[],"review_note":"Qualifying grammatical/poetics concept evidence recorded."},{"ordinal":26,"dimension":"values_ethical_concepts","status":"no_qualifying_evidence_identified","concept_evidence_ids":[],"incidental_examples":[],"review_note":"No qualifying evidence identified."},{"ordinal":27,"dimension":"body_health","status":"no_qualifying_evidence_identified","concept_evidence_ids":[],"incidental_examples":[],"review_note":"No qualifying evidence identified."},{"ordinal":28,"dimension":"named_entities","status":"no_qualifying_evidence_identified","concept_evidence_ids":[],"incidental_examples":[],"review_note":"No qualifying evidence identified."},{"ordinal":29,"dimension":"textual_intertextual_relationships","status":"no_qualifying_evidence_identified","concept_evidence_ids":[],"incidental_examples":[],"review_note":"No qualifying evidence identified."}],"concept_evidence":[{"schema_version":"0.3.0","concept_evidence_id":"gram.r15.664dcbf03c735ccb76c3a9b9","work_id":"tolkappiyam","record_id":"tolkappiyam-0149","concept_id":"knowledge.grammar.morphophonology","dimension":"knowledge_technology","surface_form":"வேற்றுமைக்கண்ணும் வல்லெழுத்து அல் வழி","source_location":"markdown:canonical-body:1:0-1:37","evidence_class":"GRAMMATICAL_CONCEPT_EVIDENCE","classification_basis":"tolkappiyam_mapping","canonical_record_sha256":"5942772656fd5560ebcc3c6d8a78fe003b32ef7164596160ed50e0c071065f26","confidence":"high","review_status":"reviewed","notes":"The நூற்பா formally governs தொகை/புணர்ச்சி surface behavior, alternation, addition, loss, or word-boundary form."}],"review_status":"reviewed","reviewer_type":"assistant_assisted","empty_cell_semantics":"No qualifying evidence identified in this reviewed நூற்பா; never evidence of historical absence.","audit_control":{"review_manifest_path":"research/audits/r15-premerge/tolkappiyam/review-manifest.json","dimension_crosswalk_path":"research/audits/r15-premerge/tolkappiyam/dimension-crosswalk.json","checked_after_fresh_source_review":true,"control_role":"coverage_and_representative_formal_support_only","crosswalk_used_to_create_classification":false},"next_record_allowed":"tolkappiyam-0150"}
