{"schema_version":"0.3.0","phase":"R1.5","production_review_id":"tolkappiyam-r15-production-0010","work_id":"tolkappiyam","record_id":"tolkappiyam-0010","source_sequence":10,"review_sequence_number":10,"source_snapshot":{"canonical_record_path":"corpus/tolkappiyam/nurpas/0010.md","canonical_record_git_blob_sha":"38b13dcec9be1a1b8bc2d77192ad966f56a1bf8a","canonical_record_sha256":"0a7a2a96d73173c7d55fc5bbbf94f083a890b0b3b3ef668431cd3d3d96e1b56c","canonical_body_sha256":"8cd3c79be6f3d0afb33cf45cc44f1ac9ca89a95eeb6495786d0f0ff69210235b","textual_status":"complete","canonical_text_available":true,"parsing_confidence":"high"},"source_structure_reviewed":{"canonical_record_id":"tolkappiyam-0010","stable_semantic_id":"ezhuthu-noolmarabu-010","traditional_number":10,"display_number":"10","adhikaram":{"id":"ezhuthu","number":1,"title_as_printed":"எழுத்ததிகாரம்"},"iyal":{"id":"ezhuthu-noolmarabu","number":1,"source_sequence":1,"title_as_printed":"நூல் மரபு"}},"dimensions_considered":29,"dimension_reviews":[{"ordinal":1,"dimension":"literary_domain","status":"no_qualifying_evidence_identified","concept_evidence_ids":[],"incidental_examples":[],"review_note":"This is a grammatical combination rule, not Akam/Puram literary-domain evidence."},{"ordinal":2,"dimension":"tinai_turai","status":"no_qualifying_evidence_identified","concept_evidence_ids":[],"incidental_examples":[],"review_note":"No tiṇai/tuṟai classification is made."},{"ordinal":3,"dimension":"landscape_environment","status":"no_qualifying_evidence_identified","concept_evidence_ids":[],"incidental_examples":[],"review_note":"No qualifying evidence identified."},{"ordinal":4,"dimension":"season_weather_time","status":"no_qualifying_evidence_identified","concept_evidence_ids":[],"incidental_examples":[],"review_note":"No qualifying evidence identified."},{"ordinal":5,"dimension":"flora","status":"no_qualifying_evidence_identified","concept_evidence_ids":[],"incidental_examples":[],"review_note":"No qualifying evidence identified."},{"ordinal":6,"dimension":"fauna","status":"no_qualifying_evidence_identified","concept_evidence_ids":[],"incidental_examples":[],"review_note":"No qualifying evidence identified."},{"ordinal":7,"dimension":"people_social_roles","status":"no_qualifying_evidence_identified","concept_evidence_ids":[],"incidental_examples":[],"review_note":"No qualifying evidence identified."},{"ordinal":8,"dimension":"relationships","status":"no_qualifying_evidence_identified","concept_evidence_ids":[],"incidental_examples":[],"review_note":"`மெய்யொடு இயையினும்` describes a formal relation between grammatical units, not a human/social/lived relationship."},{"ordinal":9,"dimension":"emotion_lived_experience","status":"no_qualifying_evidence_identified","concept_evidence_ids":[],"incidental_examples":[],"review_note":"No qualifying evidence identified."},{"ordinal":10,"dimension":"occupations_production","status":"no_qualifying_evidence_identified","concept_evidence_ids":[],"incidental_examples":[],"review_note":"No qualifying evidence identified."},{"ordinal":11,"dimension":"food_subsistence","status":"no_qualifying_evidence_identified","concept_evidence_ids":[],"incidental_examples":[],"review_note":"No qualifying evidence identified."},{"ordinal":12,"dimension":"clothing_ornaments_adornment","status":"no_qualifying_evidence_identified","concept_evidence_ids":[],"incidental_examples":[],"review_note":"No qualifying evidence identified."},{"ordinal":13,"dimension":"material_culture_everyday_objects","status":"no_qualifying_evidence_identified","concept_evidence_ids":[],"incidental_examples":[],"review_note":"No qualifying evidence identified."},{"ordinal":14,"dimension":"weapons_warfare","status":"no_qualifying_evidence_identified","concept_evidence_ids":[],"incidental_examples":[],"review_note":"No qualifying evidence identified."},{"ordinal":15,"dimension":"mobility_transport","status":"no_qualifying_evidence_identified","concept_evidence_ids":[],"incidental_examples":[],"review_note":"No qualifying evidence identified."},{"ordinal":16,"dimension":"settlements_built_environment","status":"no_qualifying_evidence_identified","concept_evidence_ids":[],"incidental_examples":[],"review_note":"No qualifying evidence identified."},{"ordinal":17,"dimension":"economy","status":"no_qualifying_evidence_identified","concept_evidence_ids":[],"incidental_examples":[],"review_note":"No qualifying evidence identified."},{"ordinal":18,"dimension":"trade_exchange","status":"no_qualifying_evidence_identified","concept_evidence_ids":[],"incidental_examples":[],"review_note":"No qualifying evidence identified."},{"ordinal":19,"dimension":"polity_political_life","status":"no_qualifying_evidence_identified","concept_evidence_ids":[],"incidental_examples":[],"review_note":"No qualifying evidence identified."},{"ordinal":20,"dimension":"communities_social_groups","status":"no_qualifying_evidence_identified","concept_evidence_ids":[],"incidental_examples":[],"review_note":"No qualifying evidence identified."},{"ordinal":21,"dimension":"family_gender_kinship","status":"no_qualifying_evidence_identified","concept_evidence_ids":[],"incidental_examples":[],"review_note":"No qualifying evidence identified."},{"ordinal":22,"dimension":"religion_ritual","status":"no_qualifying_evidence_identified","concept_evidence_ids":[],"incidental_examples":[],"review_note":"`உயிர்` is a grammatical vowel-class label here, not religious or ritual evidence."},{"ordinal":23,"dimension":"death_mourning_memory","status":"no_qualifying_evidence_identified","concept_evidence_ids":[],"incidental_examples":[],"review_note":"No qualifying evidence identified."},{"ordinal":24,"dimension":"arts_music_performance","status":"no_qualifying_evidence_identified","concept_evidence_ids":[],"incidental_examples":[],"review_note":"No qualifying evidence identified."},{"ordinal":25,"dimension":"knowledge_technology","status":"grammatical_concept_evidence_recorded","concept_evidence_ids":["gram.r15.c324b154875289d0dbf91560"],"incidental_examples":[],"review_note":"Qualifying grammatical/poetics concept evidence recorded."},{"ordinal":26,"dimension":"values_ethical_concepts","status":"no_qualifying_evidence_identified","concept_evidence_ids":[],"incidental_examples":[],"review_note":"`மெய்` is not used here as an ethical/truth-value category."},{"ordinal":27,"dimension":"body_health","status":"no_qualifying_evidence_identified","concept_evidence_ids":[],"incidental_examples":[],"review_note":"`மெய்` and `உயிர்` are grammatical labels here, not body/life/health claims."},{"ordinal":28,"dimension":"named_entities","status":"no_qualifying_evidence_identified","concept_evidence_ids":[],"incidental_examples":[],"review_note":"The grammatical classes are not historical named entities."},{"ordinal":29,"dimension":"textual_intertextual_relationships","status":"no_qualifying_evidence_identified","concept_evidence_ids":[],"incidental_examples":[],"review_note":"No qualifying evidence identified."}],"concept_evidence":[{"schema_version":"0.3.0","concept_evidence_id":"gram.r15.c324b154875289d0dbf91560","work_id":"tolkappiyam","record_id":"tolkappiyam-0010","concept_id":"knowledge.grammar.phonology","dimension":"knowledge_technology","surface_form":"மெய்யொடு இயையினும் உயிர் இயல் திரியா.","source_location":"markdown:canonical-body:1:0-1:37","evidence_class":"GRAMMATICAL_CONCEPT_EVIDENCE","classification_basis":"tolkappiyam_mapping","canonical_record_sha256":"0a7a2a96d73173c7d55fc5bbbf94f083a890b0b3b3ef668431cd3d3d96e1b56c","confidence":"high","review_status":"reviewed","notes":"The நூற்பா formally states that a vowel retains its nature even when joined with a consonant; this is a rule about grammatical combination and phonological class behavior."}],"review_status":"reviewed","reviewer_type":"assistant_assisted","empty_cell_semantics":"No qualifying evidence identified in this reviewed நூற்பா; never evidence of historical absence.","audit_control":{"review_manifest_path":"research/audits/r15-premerge/tolkappiyam/review-manifest.json","dimension_crosswalk_path":"research/audits/r15-premerge/tolkappiyam/dimension-crosswalk.json","checked_after_fresh_source_review":true,"control_role":"coverage_and_representative_formal_support_only","crosswalk_used_to_create_classification":false},"next_record_allowed":"tolkappiyam-0011"}
